caveats,insight_id,insight_type,owner_role,priority,risk_flags,title
Funnel evidence is descriptive and based on synthetic sample size.,9b48fadc89604703,funnel,Product analytics,high,small_sample|descriptive_only,Recommendation interaction is the only observed completed funnel
Retention rates use observed denominators and synthetic cohorts.,dae1715a587ab1b0,retention,Growth analytics,medium,small_sample,"Most observed retention cohorts returned, with one signup cohort at zero return"
"Churn predictions are risk indicators, not certainties.",b2ac276e2cbf9ddf,churn,Data science,high,model_risk|small_test_split,Automation activity is the strongest churn model feature in the evidence
"Segment labels are analytical interpretations, not causal identities.",173899a4e87565ec,segmentation,Product management,high,interpretation_risk,The largest interpretable segment is inactive or declining users
"Recommendation scores are rankings, not probabilities.",c2caf0f63d5a06f5,recommendation,Recommendations product,medium,offline_only,Segment-aware popularity is the selected recommendation baseline
Experiment decisions include sample-size and guardrail caveats.,9659883a7317f53a,experiment,Experiment owner,high,guardrail_failure|underpowered,Experiment evidence blocks two treatments and leaves two without clear evidence
Cross-domain insight combines evidence but does not prove causality.,c5fe31847c68741a,cross_domain,Product leadership,high,cross_domain_inference,"Activation, retention and experiment guardrails point to setup quality as a priority"
All findings are derived from synthetic NexaFlow evidence.,83d6b7826ca08084,risk_caveat,Responsible analytics,high,synthetic_data|offline_only,Synthetic evidence requires cautious interpretation
